[
  {
    "incident_id": "inc-p1-0001",
    "etape": 1,
    "type": "decision",
    "acteur": "systeme",
    "texte": "Contexte valide, enquete ouverte",
    "horodatage": "2026-10-15T10:42:00+00:00"
  },
  {
    "incident_id": "inc-p1-0001",
    "etape": 2,
    "type": "preuve",
    "acteur": "historien",
    "texte": "aucun incident similaire",
    "horodatage": "2026-10-15T10:42:01+00:00"
  },
  {
    "incident_id": "inc-p1-0001",
    "etape": 3,
    "type": "hypothese",
    "acteur": "detective",
    "texte": "Le schema des donnees a change",
    "horodatage": "2026-10-15T10:42:02+00:00"
  },
  {
    "incident_id": "inc-p1-0001",
    "etape": 4,
    "type": "hypothese",
    "acteur": "detective",
    "texte": "Saturation des ressources",
    "horodatage": "2026-10-15T10:42:03+00:00"
  },
  {
    "incident_id": "inc-p1-0001",
    "etape": 5,
    "type": "hypothese",
    "acteur": "detective",
    "texte": "Probleme reseau ou timeout",
    "horodatage": "2026-10-15T10:42:04+00:00"
  },
  {
    "incident_id": "inc-p1-0001",
    "etape": 6,
    "type": "hypothese",
    "acteur": "detective",
    "texte": "Changement de configuration",
    "horodatage": "2026-10-15T10:42:05+00:00"
  },
  {
    "incident_id": "inc-p1-0001",
    "etape": 7,
    "type": "preuve",
    "acteur": "systeme",
    "texte": "Le schema des donnees a change: [\"schema: colonne manquante amount:float\", \"schema: nouvelle colonne total:float\", \"commits: a1b2c3d: orders_etl: rename output column amount to total (2026-10-15T10:15:00Z)\", \"logs: KeyError: column <*> not found (compte=12480)\", \"logs: ERROR orders_etl: required column amount missing from input batch <*> (compte=24)\", \"logs: INFO orders_etl: input columns detected: id,total (compte=24)\"]; retenue",
    "horodatage": "2026-10-15T10:42:06+00:00"
  },
  {
    "incident_id": "inc-p1-0001",
    "etape": 8,
    "type": "rejet",
    "acteur": "systeme",
    "texte": "Saturation des ressources: []; Aucune preuve fournie par l'outil",
    "horodatage": "2026-10-15T10:42:07+00:00"
  },
  {
    "incident_id": "inc-p1-0001",
    "etape": 9,
    "type": "rejet",
    "acteur": "systeme",
    "texte": "Probleme reseau ou timeout: []; Aucune preuve fournie par l'outil",
    "horodatage": "2026-10-15T10:42:08+00:00"
  },
  {
    "incident_id": "inc-p1-0001",
    "etape": 10,
    "type": "rejet",
    "acteur": "systeme",
    "texte": "Changement de configuration: []; Aucune preuve fournie par l'outil",
    "horodatage": "2026-10-15T10:42:09+00:00"
  },
  {
    "incident_id": "inc-p1-0001",
    "etape": 11,
    "type": "decision",
    "acteur": "systeme",
    "texte": "Confiance 1.00; abstention=False",
    "horodatage": "2026-10-15T10:42:10+00:00"
  },
  {
    "incident_id": "inc-p1-0001",
    "etape": 12,
    "type": "decision",
    "acteur": "systeme",
    "texte": "Correctif propose pour validation: Restaurer le schema attendu de orders_etl: id:int, amount:float",
    "horodatage": "2026-10-15T10:42:11+00:00"
  },
  {
    "incident_id": "inc-p1-0001",
    "etape": 13,
    "type": "decision",
    "acteur": "historien",
    "texte": "Resultat provisoire enregistre en memoire",
    "horodatage": "2026-10-15T10:42:12+00:00"
  }
]
